{
  "metadata": {
    "volume": "",
    "year": 2018,
    "number": "",
    "description": "[PDFs teilweise verfügbar]",
    "importFilePath": "e2e-testing.pdf",
    "identification": "year"
  },
  "files": [
    "e2e-testing.pdf",
    "e2e-testing_2.pdf"
  ],
  "parts": [
    {
      "metadata": {
        "title": "Ein kleines Musterdokument mit zweizeiligem Titel",
        "abstract": "Bachelorarbeit",
        "author": [
          {
            "firstname": "Erich ",
            "lastname": "Mustermann"
          }
        ],
        "pages": {
          "showndesc": "1–20",
          "startPrint": 1,
          "endPrint": 20
        },
        "date_published": "2018--",
        "language": "de_DE",
        "zenonId": ""
      },
      "files": [
        {
          "file": "e2e-testing.pdf",
          "range": [
            1,
            20
          ]
        },
        {
          "file": "e2e-testing_2.pdf",
          "range": [
            1,
            22
          ]
        }
      ],
      "auto_publish": true,
      "create_frontpage": false
    },
    {
      "metadata": {
        "title": "Titel 2",
        "author": [
          {
            "firstname": "Autor",
            "lastname": "Dererste"
          }
        ],
        "pages": {
          "showndesc": "21–27",
          "startPrint": 21,
          "endPrint": 27
        },
        "date_published": "2018--",
        "language": "de_DE",
        "zenonId": ""
      },
      "files": [
        {
          "file": "e2e-testing.pdf",
          "range": [
            21,
            6
          ]
        },
        "e2e-testing_2.pdf"
      ],
      "auto_publish": true,
      "create_frontpage": false
    }
  ],
  "ojs_journal_code": "aa",
  "ojs_user": "ojs_user",
  "auto_publish_issue": false,
  "default_publish_articles": true,
  "default_create_frontpage": true,
  "allow_upload_without_file": false
}